{
  "schemaVersion": 1,
  "summary": "Hard-cut Foundation component appearance into typed sparse overrides and complete styles, then carry resolved modal-bottom-sheet appearance through Android presenters.",
  "changes": [
    { "artifact": "viewcompose-ui-foundation", "impact": "breaking" },
    { "artifact": "viewcompose-renderer-android", "impact": "feature" },
    { "artifact": "viewcompose-overlay-material3-android", "impact": "fix" },
    { "artifact": "viewcompose-overlay-oneui7-android", "impact": "fix" }
  ],
  "ignored": [
    {
      "artifact": "viewcompose-material3",
      "reason": "Production source only maps the same resolved Material recipes into the new Foundation override and Basic style contracts; the Material 3 public API and observable appearance are unchanged."
    },
    {
      "artifact": "viewcompose-oneui7",
      "reason": "Production source only constructs the new complete BasicTextFieldStyle required by the Foundation hard cut; the One UI public contract and resolved appearance are unchanged."
    },
    {
      "artifact": "viewcompose-preview",
      "reason": "The preview catalog only constructs the new complete BasicTextFieldStyle required by the Foundation hard cut; preview descriptors and public behavior are unchanged."
    }
  ]
}
