{
  "schemaVersion": 1,
  "summary": "Add snapshot-consistent observed property transactions, avoid redundant binding allocation, and harden lazy-item canonical reuse and RecyclerView tail latency.",
  "changes": [
    { "artifact": "viewcompose-runtime", "impact": "feature" },
    { "artifact": "viewcompose-ui-contract", "impact": "breaking" },
    { "artifact": "viewcompose-ui-foundation", "impact": "feature" },
    { "artifact": "viewcompose-host-android", "impact": "feature" },
    { "artifact": "viewcompose-renderer-android", "impact": "feature" }
  ],
  "ignored": []
}
