{
  "schemaVersion": 1,
  "summary": "Keep native selection controls on explicit Material semantic colors and bind Slider track and thumb roles without platform-theme fallback.",
  "changes": [
    { "artifact": "viewcompose-ui-contract", "impact": "breaking" },
    { "artifact": "viewcompose-ui-foundation", "impact": "breaking" },
    { "artifact": "viewcompose-renderer-android", "impact": "fix" }
  ],
  "ignored": []
}
