{
  "schemaVersion": 1,
  "summary": "Hard-cut the runtime artifacts into five responsibility layers, isolate Material 3 policy from the Android engine, and add one standard Android aggregate.",
  "changes": [
    { "artifact": "viewcompose-android", "impact": "feature" },
    { "artifact": "viewcompose-animation", "impact": "breaking" },
    { "artifact": "viewcompose-constraintlayout-androidx", "impact": "feature" },
    { "artifact": "viewcompose-gesture", "impact": "breaking" },
    { "artifact": "viewcompose-graphics", "impact": "breaking" },
    { "artifact": "viewcompose-host-android", "impact": "breaking" },
    { "artifact": "viewcompose-image-coil", "impact": "fix" },
    { "artifact": "viewcompose-image-glide", "impact": "fix" },
    { "artifact": "viewcompose-lifecycle-androidx", "impact": "feature" },
    { "artifact": "viewcompose-material3", "impact": "feature" },
    { "artifact": "viewcompose-navigation-android", "impact": "feature" },
    { "artifact": "viewcompose-overlay-material3-android", "impact": "feature" },
    { "artifact": "viewcompose-preview", "impact": "fix" },
    { "artifact": "viewcompose-preview-gradle-plugin", "impact": "fix" },
    { "artifact": "viewcompose-preview-runner", "impact": "fix" },
    { "artifact": "viewcompose-renderer-android", "impact": "feature" },
    { "artifact": "viewcompose-shadow-android", "impact": "fix" },
    { "artifact": "viewcompose-ui-contract", "impact": "fix" },
    { "artifact": "viewcompose-ui-foundation", "impact": "feature" },
    { "artifact": "viewcompose-viewmodel-androidx", "impact": "feature" }
  ],
  "ignored": [
    {
      "artifact": "viewcompose-preview-core",
      "reason": "Only the compiled API sample descriptor changed to follow the UI foundation package hard cut; published preview-core production source and metadata are unchanged."
    }
  ],
  "shared": [
    {
      "path": "build.gradle.kts",
      "reason": "This change replaces the repository architecture classifier and verification lists; the published effects are classified on their owning artifacts."
    },
    {
      "path": "gradle/libs.versions.toml",
      "reason": "Fragment and SavedState aliases support the new aggregate and low-level host boundaries; affected published artifacts are classified above."
    },
    {
      "path": "settings.gradle.kts",
      "reason": "This change registers the hard-cut module names and new aggregate/design-system modules; every affected published artifact is classified above."
    }
  ]
}
